### ISSUE TITLE
Issue with two containers communicating

### ISSUE THREAD

**Issue by ctrlaltdel121** [docker/libnetwork#1104]
I'm seeing an issue with the iptables rules that are set up for hairpin NAT. I'm unsure of whether I'm missing something or what I'm trying to do isn't supposed to work. I'm trying to get a client in one container to talk to a listening server in another container via the exposed port on the box.

The containers look like this:

```
CONTAINER ID        IMAGE               COMMAND             CREATED             STATUS              PORTS                      NAMES
a8b7eb2900fc        base/rhel7-devel   "/bin/bash"         About a minute ago   Up About a minute                              gloomy_wing
e7a0d212a08f        base/rhel7-devel   "/bin/bash"         2 minutes ago        Up 2 minutes        0.0.0.0:44444->12345/tcp   backstabbing_roentgen
```

When I am in the 1st container and try to go to (box's external IP address):44444 the connection just hangs. From tcpdump, I can see that the packets are not getting masqueraded.

SYN packet:
`21:57:03.253065 IP 10.249.0.19.12346 > (external-ip).44444: Flags [S], seq 4016530706, win 29200, options [mss 1460,sackOK,TS val 3034004926 ecr 0,nop,wscale 7], length 0`

SYN-ACK packet:
`21:57:03.253137 IP 10.249.0.15.12345 > 10.249.0.19.12346: Flags [S.], seq 1533837290, ack 4016530707, win 28960, options [mss 1460,sackOK,TS val 3034004926 ecr 3034004926,nop,wscale 7], length 0`

RST:
`21:57:03.253154 IP 10.249.0.19.12346 > 10.249.0.15.12345: Flags [R], seq 4016530707, win 0, length 0`

As you can see, the client sends a RST because the SYN-ACK it receives doesn't match the IP/port that it sent the SYN to. The hairpin NAT appears to not be working.

This is what my iptables -L -tnat looks like, as configured by docker

```
Chain PREROUTING (policy ACCEPT 0 packets, 0 bytes)
 pkts bytes target     prot opt in     out     source               destination         
    3  2290 DOCKER     all  --  *      *       0.0.0.0/0            0.0.0.0/0            ADDRTYPE match dst-type LOCAL

Chain INPUT (policy ACCEPT 0 packets, 0 bytes)
 pkts bytes target     prot opt in     out     source               destination         

Chain OUTPUT (policy ACCEPT 3 packets, 198 bytes)
 pkts bytes target     prot opt in     out     source               destination         
    0     0 DOCKER     all  --  *      *       0.0.0.0/0            0.0.0.0/0            ADDRTYPE match dst-type LOCAL

Chain POSTROUTING (policy ACCEPT 3 packets, 198 bytes)
 pkts bytes target     prot opt in     out     source               destination         
    0     0 MASQUERADE  all  --  *      bridge0  0.0.0.0/0            0.0.0.0/0            ADDRTYPE match src-type LOCAL
    0     0 MASQUERADE  all  --  *      !bridge0  10.249.0.0/16        0.0.0.0/0           
    0     0 MASQUERADE  tcp  --  *      *       10.249.0.3           10.249.0.3           tcp dpt:12345

Chain DOCKER (2 references)
 pkts bytes target     prot opt in     out     source               destination         
    0     0 DNAT       tcp  --  *      *       0.0.0.0/0            0.0.0.0/0            tcp dpt:44444 to:10.249.0.3:12345
```

Ultimately I was able to resolve this issue by adding the following rule:
`iptables -t nat -A POSTROUTING -o bridge0 -s 10.249.0.0/16 -d 10.249.0.0/16 -j MASQUERADE`

My question is - is this supposed to be working without this rule? Are containers supposed to be able to talk to others on the same box via exposed ports? It seems like rule 3 in the postrouting  table above handles the container talking to itself, rule 1 handles the host talking to the container, and rule 2 handles the container talking to the outside, but is container to container not supported?

Docker version:

```
Client:
 Version:      1.10.2
 API version:  1.22
 Go version:   go1.5.3
 Git commit:   c3959b1
 Built:        Mon Feb 22 16:16:33 2016
 OS/Arch:      linux/amd64

Server:
 Version:      1.10.2
 API version:  1.22
 Go version:   go1.5.3
 Git commit:   c3959b1
 Built:        Mon Feb 22 16:16:33 2016
 OS/Arch:      linux/amd64
```

Let me know if there's any other information you need to answer my question. Thanks!

**Comment by chenchun** [comment]
> My question is - is this supposed to be working without this rule?

Yes, it should. Tried it on VirtualBox with the same docker version and I can't reproduce the issue.
My tcpdump logs

```
root@docker-1:/home/vagrant# docker ps
CONTAINER ID        IMAGE               COMMAND                  CREATED             STATUS              PORTS                     NAMES
79d701169fec        redis               "/entrypoint.sh bash"    13 minutes ago      Up 13 minutes       6379/tcp                  nostalgic_saha
79b64a48a894        redis               "/entrypoint.sh redis"   14 minutes ago      Up 14 minutes       0.0.0.0:32768->6379/tcp   condescending_kare

root@docker-1:/home/vagrant# docker run -it redis bash
root@79d701169fec:/data# redis-cli -h 192.168.33.11 -p 32768
192.168.33.11:32768> set x sss
OK
192.168.33.11:32768> get x
"sss"


root@docker-1:/home/vagrant# tcpdump -vv -nn -i any ip host 10.249
tcpdump: listening on any, link-type LINUX_SLL (Linux cooked), capture size 262144 bytes
08:16:29.700897 IP (tos 0x0, ttl 64, id 59538, offset 0, flags [DF], proto TCP (6), length 60)
    10.249.0.3.49544 > 192.168.33.11.32768: Flags [S], cksum 0xecdd (incorrect -> 0x66ab), seq 698243063, win 29200, options [mss 1460,sackOK,TS val 1228645 ecr 0,nop,wscale 6], length 0
08:16:29.700922 IP (tos 0x0, ttl 64, id 59538, offset 0, flags [DF], proto TCP (6), length 60)
    10.249.0.3.49544 > 10.249.0.2.6379: Flags [S], cksum 0x1625 (incorrect -> 0xa479), seq 698243063, win 29200, options [mss 1460,sackOK,TS val 1228645 ecr 0,nop,wscale 6], length 0
08:16:29.700926 IP (tos 0x0, ttl 64, id 59538, offset 0, flags [DF], proto TCP (6), length 60)
    10.249.0.3.49544 > 10.249.0.2.6379: Flags [S], cksum 0x1625 (incorrect -> 0xa479), seq 698243063, win 29200, options [mss 1460,sackOK,TS val 1228645 ecr 0,nop,wscale 6], length 0
08:16:29.700949 IP (tos 0x0, ttl 64, id 0, offset 0, flags [DF], proto TCP (6), length 60)
    10.249.0.2.6379 > 10.249.0.3.49544: Flags [S.], cksum 0x1625 (incorrect -> 0xe8e4), seq 2215278833, ack 698243064, win 28960, options [mss 1460,sackOK,TS val 1228645 ecr 1228645,nop,wscale 6], length 0
08:16:29.700953 IP (tos 0x0, ttl 64, id 0, offset 0, flags [DF], proto TCP (6), length 60)
    192.168.33.11.32768 > 10.249.0.3.49544: Flags [S.], cksum 0xecdd (incorrect -> 0xab16), seq 2215278833, ack 698243064, win 28960, options [mss 1460,sackOK,TS val 1228645 ecr 1228645,nop,wscale 6], length 0
```

> It seems like rule 3 in the postrouting table above handles the container talking to itself, rule 1 handles the host talking to the container, and rule 2 handles the container talking to the outside, but is container to container not supported?

I think it doesn't relate with SNAT at all. There is only DNAT and un-DNAT happening here and it seems un-DNAT didn't reverse the packet to `10.249.0.19.12346 ` in your case?

**Comment by mrgleba** [comment]
I can confirm this with 1.10.3 and 1.11.2 on a cloud CentOs 7.

On the other hand I can also confirm that the issue does't show up when running in a local VirtualBox (Fedora 24).

In both cases the firewall rules were exactly equal (tested both on a cleared iptables).

My **naive, uninformed** guess would be that addrype rule in iptables somehow recognizes 10.0.0.0/8 as local (thus making it work in VBox) and doesn't recognize a regular IP of a cloud server

Some wiereshark dumps:

Cloud (without the extra POSTROUTING) - no connection
Command curl http://167.114.230.173:8087/foo from inside a container

>   1 0.000000000   172.17.0.3 -> 167.114.230.173 TCP 74 35607 > simplifymedia [SYN] Seq=0 Win=29200 Len=0 MSS=1460 SACK_PERM=1 TSval=7686642 TSecr=0 WS=128
  2 0.000182914   172.17.0.3 -> 172.17.0.2   TCP 74 35607 > simplifymedia [SYN] Seq=0 Win=29200 Len=0 MSS=1460 SACK_PERM=1 TSval=7686642 TSecr=0 WS=128
  3 0.000259918   172.17.0.2 -> 172.17.0.3   TCP 74 simplifymedia > 35607 [SYN, ACK] Seq=0 Ack=1 Win=28960 Len=0 MSS=1460 SACK_PERM=1 TSval=7686642 TSecr=7686642 WS=128
  4 0.000285630   172.17.0.3 -> 172.17.0.2   TCP 54 35607 > simplifymedia [RST] Seq=1 Win=0 Len=0
  5 1.001651202   172.17.0.3 -> 167.114.230.173 TCP 74 [TCP Retransmission] 35607 > simplifymedia [SYN] Seq=0 Win=29200 Len=0 MSS=1460 SACK_PERM=1 TSval=7687644 TSecr=0 WS=128
  6 1.001765917   172.17.0.3 -> 172.17.0.2   TCP 74 [TCP Retransmission] 35607 > simplifymedia [SYN] Seq=0 Win=29200 Len=0 MSS=1460 SACK_PERM=1 TSval=7687644 TSecr=0 WS=128
  7 1.001805964   172.17.0.2 -> 172.17.0.3   TCP 74 [TCP Previous segment not captured] simplifymedia > 35607 [SYN, ACK] Seq=15649286 Ack=1 Win=28960 Len=0 MSS=1460 SACK_PERM=1 TSval=7687644 TSecr=7687644 WS=128
  8 1.001824221   172.17.0.3 -> 172.17.0.2   TCP 54 35607 > simplifymedia [RST] Seq=1 Win=0 Len=0
  9 3.005639343   172.17.0.3 -> 167.114.230.173 TCP 74 [TCP Retransmission] 35607 > simplifymedia [SYN] Seq=0 Win=29200 Len=0 MSS=1460 SACK_PERM=1 TSval=7689648 TSecr=0 WS=128
 10 3.005735189   172.17.0.3 -> 172.17.0.2   TCP 74 [TCP Retransmission] 35607 > simplifymedia [SYN] Seq=0 Win=29200 Len=0 MSS=1460 SACK_PERM=1 TSval=7689648 TSecr=0 WS=128
 11 3.005773484   172.17.0.2 -> 172.17.0.3   TCP 74 [TCP Previous segment not captured] simplifymedia > 35607 [SYN, ACK] Seq=46961252 Ack=1 Win=28960 Len=0 MSS=1460 SACK_PERM=1 TSval=7689648 TSecr=7689648 WS=128
 12 3.005787987   172.17.0.3 -> 172.17.0.2   TCP 54 35607 > simplifymedia [RST] Seq=1 Win=0 Len=0


Cloud (with the extra POSTROUTING) - connection ok
Command curl http://167.114.230.173:8087/foo from inside a container
>  1 0.000000000   172.17.0.3 -> 167.114.230.173 TCP 74 35606 > simplifymedia [SYN] Seq=0 Win=29200 Len=0 MSS=1460 SACK_PERM=1 TSval=7333183 TSecr=0 WS=128
  2 0.000272021   172.17.0.1 -> 172.17.0.2   TCP 74 35606 > simplifymedia [SYN] Seq=0 Win=29200 Len=0 MSS=1460 SACK_PERM=1 TSval=7333183 TSecr=0 WS=128
  3 0.000360304   172.17.0.2 -> 172.17.0.1   TCP 74 simplifymedia > 35606 [SYN, ACK] Seq=0 Ack=1 Win=28960 Len=0 MSS=1460 SACK_PERM=1 TSval=7333184 TSecr=7333183 WS=128
  4 0.000412849 167.114.230.173 -> 172.17.0.3   TCP 74 simplifymedia > 35606 [SYN, ACK] Seq=0 Ack=1 Win=28960 Len=0 MSS=1460 SACK_PERM=1 TSval=7333184 TSecr=7333183 WS=128
  5 0.000446833   172.17.0.3 -> 167.114.230.173 TCP 66 35606 > simplifymedia [ACK] Seq=1 Ack=1 Win=29312 Len=0 TSval=7333184 TSecr=7333184
  6 0.000489743   172.17.0.1 -> 172.17.0.2   TCP 66 35606 > simplifymedia [ACK] Seq=1 Ack=1 Win=29312 Len=0 TSval=7333184 TSecr=7333184
  7 0.000561190   172.17.0.3 -> 167.114.230.173 HTTP 153 GET /foo HTTP/1.1 
  8 0.010559756   172.17.0.2 -> 172.17.0.1   TCP 247 [TCP ACKed unseen segment] [TCP segment of a reassembled PDU]
  9 0.010621797 167.114.230.173 -> 172.17.0.3   TCP 247 [TCP segment of a reassembled PDU]
 10 0.010632574   172.17.0.3 -> 167.114.230.173 TCP 66 35606 > simplifymedia [ACK] Seq=88 Ack=182 Win=30336 Len=0 TSval=7333194 TSecr=7333194
 11 0.010668865   172.17.0.1 -> 172.17.0.2   TCP 66 [TCP Previous segment not captured] 35606 > simplifymedia [ACK] Seq=88 Ack=182 Win=30336 Len=0 TSval=7333194 TSecr=7333194
 12 0.010929826   172.17.0.2 -> 172.17.0.1   HTTP 89 [TCP ACKed unseen segment] HTTP/1.1 200 OK  (application/octet-stream)
 13 0.010979478 167.114.230.173 -> 172.17.0.3   HTTP 89 HTTP/1.1 200 OK  (application/octet-stream)
 14 0.010987897   172.17.0.3 -> 167.114.230.173 TCP 66 35606 > simplifymedia [ACK] Seq=88 Ack=205 Win=30336 Len=0 TSval=7333194 TSecr=7333194
 15 0.014898723   172.17.0.2 -> 172.17.0.1   TCP 66 [TCP ACKed unseen segment] simplifymedia > 35606 [FIN, ACK] Seq=205 Ack=89 Win=29056 Len=0 TSval=7333198 TSecr=7333196
 16 0.014948398 167.114.230.173 -> 172.17.0.3   TCP 66 [TCP ACKed unseen segment] simplifymedia > 35606 [FIN, ACK] Seq=205 Ack=89 Win=29056 Len=0 TSval=7333198 TSecr=7333196
 17 0.014958195   172.17.0.3 -> 167.114.230.173 TCP 66 [TCP Previous segment not captured] 35606 > simplifymedia [ACK] Seq=89 Ack=206 Win=30336 Len=0 TSval=7333198 TSecr=7333198
 18 0.015007333   172.17.0.1 -> 172.17.0.2   TCP 66 [TCP Previous segment not captured] 35606 > simplifymedia [ACK] Seq=89 Ack=206 Win=30336 Len=0 TSval=7333198 TSecr=7333198


VirtualBox (without the extra POSTROUTING) - connection ok
Command: curl http://10.0.2.15:8087/foo from inside a container

>   1 0.000000000   172.17.0.3 → 172.17.0.2   TCP 74 35424→8087 [SYN] Seq=0 Win=29200 Len=0 MSS=1460 SACK_PERM=1 TSval=10664505 TSecr=0 WS=128
  2 0.000063726   172.17.0.3 → 172.17.0.2   TCP 74 [TCP Out-Of-Order] 35424→8087 [SYN] Seq=0 Win=29200 Len=0 MSS=1460 SACK_PERM=1 TSval=10664505 TSecr=0 WS=128
  3 0.000095948   172.17.0.2 → 172.17.0.3   TCP 74 8087→35424 [SYN, ACK] Seq=0 Ack=1 Win=28960 Len=0 MSS=1460 SACK_PERM=1 TSval=10664506 TSecr=10664505 WS=128
  4 0.000101644   172.17.0.2 → 172.17.0.3   TCP 74 [TCP Out-Of-Order] 8087→35424 [SYN, ACK] Seq=0 Ack=1 Win=28960 Len=0 MSS=1460 SACK_PERM=1 TSval=10664506 TSecr=10664505 WS=128
  5 0.000134765   172.17.0.3 → 172.17.0.2   TCP 66 35424→8087 [ACK] Seq=1 Ack=1 Win=29312 Len=0 TSval=10664506 TSecr=10664506
  6 0.000150922   172.17.0.3 → 172.17.0.2   TCP 66 [TCP Dup ACK 5#1] 35424→8087 [ACK] Seq=1 Ack=1 Win=29312 Len=0 TSval=10664506 TSecr=10664506
  7 0.000137886   172.17.0.3 → 172.17.0.2   TCP 66 [TCP Dup ACK 5#2] 35424→8087 [ACK] Seq=1 Ack=1 Win=29312 Len=0 TSval=10664506 TSecr=10664506
  8 0.000157701   172.17.0.3 → 172.17.0.2   TCP 66 [TCP Dup ACK 5#3] 35424→8087 [ACK] Seq=1 Ack=1 Win=29312 Len=0 TSval=10664506 TSecr=10664506
  9 0.000225720   172.17.0.3 → 172.17.0.2   HTTP 147 GET /foo HTTP/1.1 
 10 0.000251591   172.17.0.3 → 172.17.0.2   TCP 147 [TCP Retransmission] 35424→8087 [PSH, ACK] Seq=1 Ack=1 Win=29312 Len=81 TSval=10664506 TSecr=10664506
 11 0.000261387   172.17.0.2 → 172.17.0.3   TCP 66 8087→35424 [ACK] Seq=1 Ack=82 Win=29056 Len=0 TSval=10664506 TSecr=10664506
 12 0.000265366   172.17.0.2 → 172.17.0.3   TCP 78 [TCP Dup ACK 11#1] 8087→35424 [ACK] Seq=1 Ack=82 Win=29056 Len=0 TSval=10664506 TSecr=10664506 SLE=1 SRE=82
 13 0.002598362   172.17.0.2 → 172.17.0.3   TCP 247 [TCP segment of a reassembled PDU]
 14 0.002656079   172.17.0.3 → 172.17.0.2   TCP 66 35424→8087 [ACK] Seq=82 Ack=182 Win=30336 Len=0 TSval=10664508 TSecr=10664508
 15 0.002682778   172.17.0.3 → 172.17.0.2   TCP 66 [TCP Dup ACK 14#1] 35424→8087 [ACK] Seq=82 Ack=182 Win=30336 Len=0 TSval=10664508 TSecr=10664508
 16 0.003003195   172.17.0.2 → 172.17.0.3   HTTP 89 HTTP/1.1 200 OK  (application/octet-stream)
 17 0.003042714   172.17.0.3 → 172.17.0.2   TCP 66 35424→8087 [ACK] Seq=82 Ack=205 Win=30336 Len=0 TSval=10664509 TSecr=10664509
 18 0.003066226   172.17.0.3 → 172.17.0.2   TCP 66 [TCP Dup ACK 17#1] 35424→8087 [ACK] Seq=82 Ack=205 Win=30336 Len=0 TSval=10664509 TSecr=10664509
 19 0.003144381   172.17.0.3 → 172.17.0.2   TCP 66 35424→8087 [FIN, ACK] Seq=82 Ack=205 Win=30336 Len=0 TSval=10664509 TSecr=10664509
 20 0.003174387   172.17.0.3 → 172.17.0.2   TCP 66 [TCP Out-Of-Order] 35424→8087 [FIN, ACK] Seq=82 Ack=205 Win=30336 Len=0 TSval=10664509 TSecr=10664509
 21 0.003203889   172.17.0.2 → 172.17.0.3   TCP 78 8087→35424 [ACK] Seq=205 Ack=83 Win=29056 Len=0 TSval=10664509 TSecr=10664509 SLE=82 SRE=83
 22 0.003594689   172.17.0.2 → 172.17.0.3   TCP 66 8087→35424 [FIN, ACK] Seq=205 Ack=83 Win=29056 Len=0 TSval=10664509 TSecr=10664509
 23 0.003631090   172.17.0.3 → 172.17.0.2   TCP 66 35424→8087 [ACK] Seq=83 Ack=206 Win=30336 Len=0 TSval=10664509 TSecr=10664509
 24 0.003685333   172.17.0.3 → 172.17.0.2   TCP 66 [TCP Dup ACK 23#1] 35424→8087 [ACK] Seq=83 Ack=206 Win=30336 Len=0 TSval=10664509 TSecr=10664509

**Comment by mrgleba** [comment]
OK found a simpler solution:
echo 1 > /proc/sys/net/bridge/bridge-nf-call-iptables
and then no extra rule is necessary.

On RHEL based systems this seems to be disabled by default.
https://bugzilla.redhat.com/show_bug.cgi?id=512206

**Comment by odg0318** [comment]
@mrgleba It removed my stuff. Thanks
