### ISSUE TITLE
Docker Swarm Host - dockerd w/ Multiple Interfaces (eth0 & eth1)

### ISSUE THREAD

**Issue by jaredvacanti** [docker/libnetwork#2395]
I have a docker swarm cluster running engine 18.09-ce. One node, running Amazon Linux 2 (a fork of Centos 7), has two physical interfaces on the same subnet (ENIs attached to an AWS EC2 Instance) with 1-to-1 NATing from public IP addresses to these RFC1918 addresses associated with the ENIs.

I can successfully:

- `ping` the host externally (from my laptop on a different network) via both public addresses
- access traditional host services running on both interfaces (e.g. `service start nginx` responds on both ENIs via `curl <public-address>`)
- containers in `--network=host` mode work on both interfaces (e.g. can `curl <public-address>` a running nginx container via both ENIs)

I **cannot** access via the second ENI:

- when run as `docker run -d -p 0.0.0.0:80:80 nginx`
- when run as a docker swarm service with 'host-mode' publishing

In both of these 'failure' scenarios I can still access the container from the primary ENI.

I have noticed some issues that may be relevant:

1. https://github.com/docker/libnetwork/issues/758
2. https://github.com/moby/moby/issues/24317

**Is it possible to accept traffic from multiple physical interfaces when scheduling services with Docker Swarm?** Is there some internal restriction with the data-plane or another docker engine feature that is prohibiting this? Are there other ways to make it work?

**Comment by selansen** [comment]
Looks like we don't  support by going through below comment in the past
```When there is a bridge in between the packets from the container have to be natted and so one interface has to be choosen```

To Answer your question on making it work with possible workaround :
  Can you pls use tcpdump and see where the packets getting dropped?  We will dig more into this and see if we can provide any workaround.

**Comment by jaredvacanti** [comment]
Here are relevant networking details:
```
[ec2-user@ip-10-0-0-168 ~]$ ip rule
0:	from all lookup local 
32765:	from 10.0.0.139 lookup 10001 
32766:	from all lookup main 
32767:	from all lookup default 
```

```
[ec2-user@ip-10-0-0-168 ~]$ ip route show table all
default via 10.0.0.1 dev eth1 table 10001 
10.0.0.0/24 dev eth1 table 10001 proto kernel scope link src 10.0.0.139 
default via 10.0.0.1 dev eth0 
default via 10.0.0.1 dev eth1 metric 10001 
10.0.0.0/24 dev eth0 proto kernel scope link src 10.0.0.168 
10.0.0.0/24 dev eth1 proto kernel scope link src 10.0.0.139 
169.254.169.254 dev eth0 
172.17.0.0/16 dev docker0 proto kernel scope link src 172.17.0.1 
172.18.0.0/16 dev docker_gwbridge proto kernel scope link src 172.18.0.1 
broadcast 10.0.0.0 dev eth0 table local proto kernel scope link src 10.0.0.168 
broadcast 10.0.0.0 dev eth1 table local proto kernel scope link src 10.0.0.139 
local 10.0.0.118 dev eth0 table local proto kernel scope host src 10.0.0.168 
local 10.0.0.139 dev eth1 table local proto kernel scope host src 10.0.0.139 
local 10.0.0.168 dev eth0 table local proto kernel scope host src 10.0.0.168 
broadcast 10.0.0.255 dev eth0 table local proto kernel scope link src 10.0.0.168 
broadcast 10.0.0.255 dev eth1 table local proto kernel scope link src 10.0.0.139 
broadcast 127.0.0.0 dev lo table local proto kernel scope link src 127.0.0.1 
local 127.0.0.0/8 dev lo table local proto kernel scope host src 127.0.0.1 
local 127.0.0.1 dev lo table local proto kernel scope host src 127.0.0.1 
broadcast 127.255.255.255 dev lo table local proto kernel scope link src 127.0.0.1 
broadcast 172.17.0.0 dev docker0 table local proto kernel scope link src 172.17.0.1 
local 172.17.0.1 dev docker0 table local proto kernel scope host src 172.17.0.1 
broadcast 172.17.255.255 dev docker0 table local proto kernel scope link src 172.17.0.1 
broadcast 172.18.0.0 dev docker_gwbridge table local proto kernel scope link src 172.18.0.1 
local 172.18.0.1 dev docker_gwbridge table local proto kernel scope host src 172.18.0.1 
broadcast 172.18.255.255 dev docker_gwbridge table local proto kernel scope link src 172.18.0.1 
default via fe80::e9:2fff:fe34:56b4 dev eth1 table 10001 metric 1024 pref medium
unreachable ::/96 dev lo metric 1024 error -113 pref medium
unreachable ::ffff:0.0.0.0/96 dev lo metric 1024 error -113 pref medium
unreachable 2002:a00::/24 dev lo metric 1024 error -113 pref medium
unreachable 2002:7f00::/24 dev lo metric 1024 error -113 pref medium
unreachable 2002:a9fe::/32 dev lo metric 1024 error -113 pref medium
unreachable 2002:ac10::/28 dev lo metric 1024 error -113 pref medium
unreachable 2002:c0a8::/32 dev lo metric 1024 error -113 pref medium
unreachable 2002:e000::/19 dev lo metric 1024 error -113 pref medium
2600:1f18:382:a100::/64 dev eth0 proto kernel metric 256 pref medium
2600:1f18:382:a100::/64 dev eth1 proto kernel metric 256 pref medium
unreachable 3ffe:ffff::/32 dev lo metric 1024 error -113 pref medium
fe80::/64 dev eth0 proto kernel metric 256 pref medium
fe80::/64 dev eth1 proto kernel metric 256 pref medium
fe80::/64 dev docker_gwbridge proto kernel metric 256 pref medium
fe80::/64 dev veth9cffedf proto kernel metric 256 pref medium
fe80::/64 dev veth26a5341 proto kernel metric 256 pref medium
fe80::/64 dev vethad9e384 proto kernel metric 256 pref medium
fe80::/64 dev vethf2c983e proto kernel metric 256 pref medium
fe80::/64 dev docker0 proto kernel metric 256 pref medium
fe80::/64 dev veth7be0a9f proto kernel metric 256 pref medium
fe80::/64 dev veth3d40458 proto kernel metric 256 pref medium
default via fe80::e9:2fff:fe34:56b4 dev eth0 proto ra metric 1024 expires 1799sec hoplimit 64 pref medium
default via fe80::e9:2fff:fe34:56b4 dev eth1 proto ra metric 1024 expires 1798sec hoplimit 64 pref medium
local ::1 dev lo table local proto kernel metric 0 pref medium
local 2600:1f18:382:a100:92c3:c6d3:5e26:a8a6 dev eth0 table local proto kernel metric 0 pref medium
local 2600:1f18:382:a100:e326:99e4:1393:1559 dev eth1 table local proto kernel metric 0 pref medium
local fe80::42:b8ff:fe53:2c78 dev docker0 table local proto kernel metric 0 pref medium
local fe80::42:fdff:fe74:cc09 dev docker_gwbridge table local proto kernel metric 0 pref medium
local fe80::6d:2bff:fe98:545e dev eth1 table local proto kernel metric 0 pref medium
local fe80::81:a8ff:fe2e:788e dev eth0 table local proto kernel metric 0 pref medium
local fe80::6c0c:65ff:fedc:c850 dev veth9cffedf table local proto kernel metric 0 pref medium
local fe80::6c58:2aff:fe0c:1c1f dev veth7be0a9f table local proto kernel metric 0 pref medium
local fe80::847c:41ff:fee2:c83 dev veth26a5341 table local proto kernel metric 0 pref medium
local fe80::946f:13ff:fe10:c120 dev vethad9e384 table local proto kernel metric 0 pref medium
local fe80::ac52:7cff:febe:1a09 dev veth3d40458 table local proto kernel metric 0 pref medium
local fe80::e4f6:abff:fe21:5ef8 dev vethf2c983e table local proto kernel metric 0 pref medium
ff00::/8 dev eth0 table local metric 256 pref medium
ff00::/8 dev eth1 table local metric 256 pref medium
ff00::/8 dev docker_gwbridge table local metric 256 pref medium
ff00::/8 dev veth9cffedf table local metric 256 pref medium
ff00::/8 dev veth26a5341 table local metric 256 pref medium
ff00::/8 dev vethad9e384 table local metric 256 pref medium
ff00::/8 dev vethf2c983e table local metric 256 pref medium
ff00::/8 dev docker0 table local metric 256 pref medium
ff00::/8 dev veth7be0a9f table local metric 256 pref medium
ff00::/8 dev veth3d40458 table local metric 256 pref medium
```

```
[ec2-user@ip-10-0-0-168 ~]$ sudo iptables-save -c
# Generated by iptables-save v1.4.21 on Mon Jun 17 16:25:25 2019
*raw
:PREROUTING ACCEPT [4997523:2854067953]
:OUTPUT ACCEPT [3428852:2749191068]
[11722:1036764] -A PREROUTING -i eth1 -j TRACE
COMMIT
# Completed on Mon Jun 17 16:25:25 2019
# Generated by iptables-save v1.4.21 on Mon Jun 17 16:25:25 2019
*mangle
:PREROUTING ACCEPT [12625678:7503605304]
:INPUT ACCEPT [12374640:7405980422]
:FORWARD ACCEPT [250498:97594705]
:OUTPUT ACCEPT [8613602:6911465043]
:POSTROUTING ACCEPT [8864097:7009058335]
COMMIT
# Completed on Mon Jun 17 16:25:25 2019
# Generated by iptables-save v1.4.21 on Mon Jun 17 16:25:25 2019
*nat
:PREROUTING ACCEPT [82028:5855452]
:INPUT ACCEPT [81880:5846544]
:OUTPUT ACCEPT [94301:6801574]
:POSTROUTING ACCEPT [95084:6845505]
:DOCKER - [0:0]
:DOCKER-INGRESS - [0:0]
[83361:5932124] -A PREROUTING -m addrtype --dst-type LOCAL -j DOCKER-INGRESS
[83608:5953689] -A PREROUTING -m addrtype --dst-type LOCAL -j DOCKER
[0:0] -A OUTPUT -m addrtype --dst-type LOCAL -j DOCKER-INGRESS
[0:0] -A OUTPUT ! -d 127.0.0.0/8 -m addrtype --dst-type LOCAL -j DOCKER
[0:0] -A POSTROUTING -o docker_gwbridge -m addrtype --src-type LOCAL -j MASQUERADE
[11:732] -A POSTROUTING -s 172.18.0.0/16 ! -o docker_gwbridge -j MASQUERADE
[187:11220] -A POSTROUTING -s 172.17.0.0/16 ! -o docker0 -j MASQUERADE
[0:0] -A POSTROUTING -s 172.18.0.4/32 -d 172.18.0.4/32 -p tcp -m tcp --dport 8500 -j MASQUERADE
[0:0] -A POSTROUTING -s 172.17.0.2/32 -d 172.17.0.2/32 -p udp -m udp --dport 1194 -j MASQUERADE
[0:0] -A POSTROUTING -s 172.18.0.5/32 -d 172.18.0.5/32 -p tcp -m tcp --dport 2022 -j MASQUERADE
[0:0] -A POSTROUTING -s 172.18.0.5/32 -d 172.18.0.5/32 -p tcp -m tcp --dport 443 -j MASQUERADE
[0:0] -A POSTROUTING -s 172.18.0.5/32 -d 172.18.0.5/32 -p tcp -m tcp --dport 80 -j MASQUERADE
[0:0] -A POSTROUTING -s 172.18.0.7/32 -d 172.18.0.7/32 -p tcp -m tcp --dport 5555 -j MASQUERADE
[0:0] -A DOCKER -i docker_gwbridge -j RETURN
[0:0] -A DOCKER -i docker0 -j RETURN
[0:0] -A DOCKER ! -i docker_gwbridge -p tcp -m tcp --dport 8500 -j DNAT --to-destination 172.18.0.4:8500
[6:310] -A DOCKER ! -i docker0 -p udp -m udp --dport 1194 -j DNAT --to-destination 172.17.0.2:1194
[0:0] -A DOCKER ! -i docker_gwbridge -p tcp -m tcp --dport 2022 -j DNAT --to-destination 172.18.0.5:2022
[674:39964] -A DOCKER ! -i docker_gwbridge -p tcp -m tcp --dport 443 -j DNAT --to-destination 172.18.0.5:443
[515:27548] -A DOCKER ! -i docker_gwbridge -p tcp -m tcp --dport 80 -j DNAT --to-destination 172.18.0.5:80
[175:9096] -A DOCKER ! -i docker_gwbridge -p tcp -m tcp --dport 5555 -j DNAT --to-destination 172.18.0.7:5555
[83361:5932124] -A DOCKER-INGRESS -j RETURN
COMMIT
# Completed on Mon Jun 17 16:25:25 2019
# Generated by iptables-save v1.4.21 on Mon Jun 17 16:25:25 2019
*filter
:INPUT ACCEPT [12307371:7151772023]
:FORWARD DROP [0:0]
:OUTPUT ACCEPT [8579156:6892811463]
:DOCKER - [0:0]
:DOCKER-INGRESS - [0:0]
:DOCKER-ISOLATION-STAGE-1 - [0:0]
:DOCKER-ISOLATION-STAGE-2 - [0:0]
:DOCKER-USER - [0:0]
[246058:95832116] -A FORWARD -j DOCKER-USER
[246058:95832116] -A FORWARD -j DOCKER-INGRESS
[250498:97594705] -A FORWARD -j DOCKER-ISOLATION-STAGE-1
[106682:15980472] -A FORWARD -o docker_gwbridge -m conntrack --ctstate RELATED,ESTABLISHED -j ACCEPT
[827:46576] -A FORWARD -o docker_gwbridge -j DOCKER
[117382:69205297] -A FORWARD -i docker_gwbridge ! -o docker_gwbridge -j ACCEPT
[11870:6096210] -A FORWARD -o docker0 -m conntrack --ctstate RELATED,ESTABLISHED -j ACCEPT
[4:225] -A FORWARD -o docker0 -j DOCKER
[13733:6265925] -A FORWARD -i docker0 ! -o docker0 -j ACCEPT
[0:0] -A FORWARD -i docker0 -o docker0 -j ACCEPT
[0:0] -A FORWARD -i docker_gwbridge -o docker_gwbridge -j DROP
[0:0] -A DOCKER -d 172.18.0.4/32 ! -i docker_gwbridge -o docker_gwbridge -p tcp -m tcp --dport 8500 -j ACCEPT
[4:225] -A DOCKER -d 172.17.0.2/32 ! -i docker0 -o docker0 -p udp -m udp --dport 1194 -j ACCEPT
[0:0] -A DOCKER -d 172.18.0.5/32 ! -i docker_gwbridge -o docker_gwbridge -p tcp -m tcp --dport 2022 -j ACCEPT
[474:28248] -A DOCKER -d 172.18.0.5/32 ! -i docker_gwbridge -o docker_gwbridge -p tcp -m tcp --dport 443 -j ACCEPT
[264:13596] -A DOCKER -d 172.18.0.5/32 ! -i docker_gwbridge -o docker_gwbridge -p tcp -m tcp --dport 80 -j ACCEPT
[89:4732] -A DOCKER -d 172.18.0.7/32 ! -i docker_gwbridge -o docker_gwbridge -p tcp -m tcp --dport 5555 -j ACCEPT
[246058:95832116] -A DOCKER-INGRESS -j RETURN
[117382:69205297] -A DOCKER-ISOLATION-STAGE-1 -i docker_gwbridge ! -o docker_gwbridge -j DOCKER-ISOLATION-STAGE-2
[13733:6265925] -A DOCKER-ISOLATION-STAGE-1 -i docker0 ! -o docker0 -j DOCKER-ISOLATION-STAGE-2
[250498:97594705] -A DOCKER-ISOLATION-STAGE-1 -j RETURN
[0:0] -A DOCKER-ISOLATION-STAGE-2 -o docker_gwbridge -j DROP
[0:0] -A DOCKER-ISOLATION-STAGE-2 -o docker0 -j DROP
[131115:75471222] -A DOCKER-ISOLATION-STAGE-2 -j RETURN
[250498:97594705] -A DOCKER-USER -j RETURN
COMMIT
# Completed on Mon Jun 17 16:25:25 2019
```

**Scenario 1:** `docker run -d -p 0.0.0.0:80:80 nginx`
Connecting over `eth0`: (**SUCESSFUL**)
Host `tcpdump`:
```
[ec2-user@ip-10-0-0-168 ~]$ sudo tcpdump -i eth0 -n port http or port https
tcpdump: verbose output suppressed, use -v or -vv for full protocol decode
listening on eth0, link-type EN10MB (Ethernet), capture size 262144 bytes
16:36:29.002005 IP <my-public-ip>.53154 > 10.0.0.168.http: Flags [F.], seq 1232190746, ack 2223573541, win 501, options [nop,nop,TS val 1204018717 ecr 1705324398], length 0
16:36:29.002097 IP 10.0.0.168.http > <my-public-ip>.53154: Flags [.], ack 1, win 243, options [nop,nop,TS val 1705350741 ecr 1204018717], length 0
16:36:29.006126 IP <my-public-ip>.53190 > 10.0.0.168.http: Flags [S], seq 52341307, win 64240, options [mss 1460,sackOK,TS val 1204018717 ecr 0,nop,wscale 7], length 0
16:36:29.006221 IP 10.0.0.168.http > <my-public-ip>.53190: Flags [S.], seq 3462946480, ack 52341308, win 28960, options [mss 1460,sackOK,TS val 1705350745 ecr 1204018717,nop,wscale 7], length 0
16:36:29.043760 IP <my-public-ip>.53190 > 10.0.0.168.http: Flags [.], ack 1, win 502, options [nop,nop,TS val 1204018756 ecr 1705350745], length 0
16:36:29.043799 IP <my-public-ip>.53190 > 10.0.0.168.http: Flags [P.], seq 1:522, ack 1, win 502, options [nop,nop,TS val 1204018756 ecr 1705350745], length 521: HTTP: GET / HTTP/1.1
16:36:29.043889 IP 10.0.0.168.http > <my-public-ip>.53190: Flags [.], ack 522, win 235, options [nop,nop,TS val 1705350783 ecr 1204018756], length 0
16:36:29.044193 IP 10.0.0.168.http > <my-public-ip>.53190: Flags [P.], seq 1:181, ack 522, win 235, options [nop,nop,TS val 1705350783 ecr 1204018756], length 180: HTTP: HTTP/1.1 304 Not Modified
16:36:29.080268 IP <my-public-ip>.53190 > 10.0.0.168.http: Flags [.], ack 181, win 501, options [nop,nop,TS val 1204018795 ecr 1705350783], length 0
^C
9 packets captured
10 packets received by filter
0 packets dropped by kernel
```

Netshoot container `tcpdump`:
```
 [7] 🐳  → tcpdump -i eth0 -n
tcpdump: verbose output suppressed, use -v or -vv for full protocol decode
listening on eth0, link-type EN10MB (Ethernet), capture size 262144 bytes
16:36:29.002062 IP <my-public-ip>.53154 > 172.17.0.3.80: Flags [F.], seq 1232190746, ack 2223573541, win 501, options [nop,nop,TS val 1204018717 ecr 1705324398], length 0
16:36:29.002083 IP 172.17.0.3.80 > <my-public-ip>.53154: Flags [.], ack 1, win 243, options [nop,nop,TS val 1705350741 ecr 1204018717], length 0
16:36:29.006187 IP <my-public-ip>.53190 > 172.17.0.3.80: Flags [S], seq 52341307, win 64240, options [mss 1460,sackOK,TS val 1204018717 ecr 0,nop,wscale 7], length 0
16:36:29.006209 IP 172.17.0.3.80 > <my-public-ip>.53190: Flags [S.], seq 3462946480, ack 52341308, win 28960, options [mss 1460,sackOK,TS val 1705350745 ecr 1204018717,nop,wscale 7], length 0
16:36:29.043832 IP <my-public-ip>.53190 > 172.17.0.3.80: Flags [.], ack 1, win 502, options [nop,nop,TS val 1204018756 ecr 1705350745], length 0
16:36:29.043869 IP <my-public-ip>.53190 > 172.17.0.3.80: Flags [P.], seq 1:522, ack 1, win 502, options [nop,nop,TS val 1204018756 ecr 1705350745], length 521: HTTP: GET / HTTP/1.1
16:36:29.043878 IP 172.17.0.3.80 > <my-public-ip>.53190: Flags [.], ack 522, win 235, options [nop,nop,TS val 1705350783 ecr 1204018756], length 0
16:36:29.044116 IP 172.17.0.3.80 > <my-public-ip>.53190: Flags [P.], seq 1:181, ack 522, win 235, options [nop,nop,TS val 1705350783 ecr 1204018756], length 180: HTTP: HTTP/1.1 304 Not Modified
16:36:29.080360 IP <my-public-ip>.53190 > 172.17.0.3.80: Flags [.], ack 181, win 501, options [nop,nop,TS val 1204018795 ecr 1705350783], length 0
^C
9 packets captured
9 packets received by filter
0 packets dropped by kernel
```

Connecting over `eth1`: (**UNSUCESSFUL**)
Host `tcpdump`:
```
[ec2-user@ip-10-0-0-168 ~]$ sudo tcpdump -i eth1 -n port http or port https
tcpdump: verbose output suppressed, use -v or -vv for full protocol decode
listening on eth1, link-type EN10MB (Ethernet), capture size 262144 bytes
16:38:31.139547 IP 92.118.37.91.50358 > 10.0.0.139.https: Flags [S], seq 286234344, win 29200, options [mss 1460,sackOK,TS val 780528474 ecr 0,nop,wscale 7], length 0
16:38:31.440528 IP 10.0.0.139.https > 92.118.37.91.50358: Flags [R.], seq 0, ack 286234345, win 0, length 0
16:38:58.672586 IP <my-public-ip>.58694 > 10.0.0.139.http: Flags [S], seq 1883489573, win 64240, options [mss 1460,sackOK,TS val 3485936318 ecr 0,nop,wscale 7], length 0
16:38:58.876952 IP <my-public-ip>.58696 > 10.0.0.139.http: Flags [S], seq 840764397, win 64240, options [mss 1460,sackOK,TS val 3485936525 ecr 0,nop,wscale 7], length 0
16:38:59.687312 IP <my-public-ip>.58694 > 10.0.0.139.http: Flags [S], seq 1883489573, win 64240, options [mss 1460,sackOK,TS val 3485937335 ecr 0,nop,wscale 7], length 0
16:38:59.882921 IP <my-public-ip>.58696 > 10.0.0.139.http: Flags [S], seq 840764397, win 64240, options [mss 1460,sackOK,TS val 3485937531 ecr 0,nop,wscale 7], length 0
16:39:01.703166 IP <my-public-ip>.58694 > 10.0.0.139.http: Flags [S], seq 1883489573, win 64240, options [mss 1460,sackOK,TS val 3485939351 ecr 0,nop,wscale 7], length 0
16:39:01.902970 IP <my-public-ip>.58696 > 10.0.0.139.http: Flags [S], seq 840764397, win 64240, options [mss 1460,sackOK,TS val 3485939543 ecr 0,nop,wscale 7], length 0
16:39:05.959761 IP <my-public-ip>.58694 > 10.0.0.139.http: Flags [S], seq 1883489573, win 64240, options [mss 1460,sackOK,TS val 3485943607 ecr 0,nop,wscale 7], length 0
16:39:06.190119 IP <my-public-ip>.58696 > 10.0.0.139.http: Flags [S], seq 840764397, win 64240, options [mss 1460,sackOK,TS val 3485943607 ecr 0,nop,wscale 7], length 0
16:39:14.151122 IP <my-public-ip>.58694 > 10.0.0.139.http: Flags [S], seq 1883489573, win 64240, options [mss 1460,sackOK,TS val 3485951799 ecr 0,nop,wscale 7], length 0
16:39:14.280590 IP <my-public-ip>.58696 > 10.0.0.139.http: Flags [S], seq 840764397, win 64240, options [mss 1460,sackOK,TS val 3485951799 ecr 0,nop,wscale 7], length 0

```

Netshoot container `tcpdump`:
```
 [10] 🐳  → tcpdump -i any -n
tcpdump: verbose output suppressed, use -v or -vv for full protocol decode
listening on any, link-type LINUX_SLL (Linux cooked), capture size 262144 bytes
16:38:25.539081 ARP, Request who-has 172.17.0.1 tell 172.17.0.3, length 28
16:38:25.539126 ARP, Request who-has 172.17.0.3 tell 172.17.0.1, length 28
16:38:25.539130 ARP, Reply 172.17.0.3 is-at 02:42:ac:11:00:03, length 28
16:38:25.539131 ARP, Reply 172.17.0.1 is-at 02:42:b8:53:2c:78, length 28
16:38:58.656677 IP <my-public-ip>.53190 > 172.17.0.3.80: Flags [F.], seq 52341829, ack 3462946662, win 501, options [nop,nop,TS val 1204168341 ecr 1705462129], length 0
16:38:58.656705 IP 172.17.0.3.80 > <my-public-ip>.53190: Flags [R], seq 3462946662, win 0, length 0
16:39:03.683133 ARP, Request who-has 172.17.0.3 tell 172.17.0.1, length 28
16:39:03.683155 ARP, Reply 172.17.0.3 is-at 02:42:ac:11:00:03, length 28
16:39:30.723449 IP6 fe80::f0e1:84ff:fec7:c06e > ff02::2: ICMP6, router solicitation, length 16
^C
9 packets captured
9 packets received by filter
0 packets dropped by kernel
```
