### ISSUE TITLE
DST port of VXLAN is dot port of OTV in tcpdump

### ISSUE THREAD

**Issue by runseb** [docker/libnetwork#358]
When you tcpdump traffic of containers in an overlay you get things like this:

    12:58:47.102776 IP 192.168.33.11.7946 > 192.168.33.12.7946: UDP, length 22
    12:58:47.103138 IP 192.168.33.12.7946 > 192.168.33.11.7946: UDP, length 11
    12:58:47.195567 IP 192.168.33.12.7946 > 192.168.33.11.7946: UDP, length 22
    12:58:47.195932 IP 192.168.33.11.7946 > 192.168.33.12.7946: UDP, length 11
    12:58:47.337975 IP 192.168.33.11.53814 > 192.168.33.12.8472: OTV, flags [I] (0x08), overlay 0,     instance 257
    IP 172.21.0.1 > 172.21.0.2: ICMP echo request, id 26, seq 76, length 64
    12:58:47.338083 IP 192.168.33.12.50891 > 192.168.33.11.8472: OTV, flags [I] (0x08), overlay 0, instance 257
    IP 172.21.0.2 > 172.21.0.1: ICMP echo reply, id 26, seq 76, length 64

in tcpdump , OTV_PORT is 8472 and VXLAN_PORT is 4789. 

So it seems tcpdump sees your vxlan traffic and prints it as OTV…a bit confusing.

Any chance to switch to 4789, so that tcpdump prints out VXLAN packets.

**Comment by mrjana** [comment]
@runseb We will fix it to switch to IANA assigned port number so that we can keep all the packet dump tools happy

**Comment by mavenugo** [comment]
@sanimej identified an issue with the fix #361. Though we set the vxlan id as 4789, the actual udp dst port used in the packets were 46354. Thats because of endian issue in the netlink library :
`4789 is 0x12b5.. but the port used in the pkts is 46354 which is 0xb512`

Reopening it so that @sanimej can fix it.

**Comment by aboch** [comment]
Fixed by @sanimej in #447
